,City,Details
0,Wyoming,"Wyoming, United States"
1,Denton,"Denton County, Texas, United States"
2,Gainesville,"Gainesville, Alachua County, Florida, United States"
3,Redwood City,"Redwood City, San Mateo County, California, United States"
4,Winter Haven,"Winter Haven, Polk County, Florida, United States"
5,East Lansing,"East Lansing, Ingham County, Michigan, United States"
6,Euless,"Euless, Tarrant County, Texas, United States"
7,Springdale,"Springdale, Washington County, Arkansas, United States"
8,Seattle,"Seattle, King County, Washington, United States"
9,Fort Washington,"Fort Washington, Prince George's County, Maryland, United States"
10,Richmond,"Richmond, Virginia, United States"
11,Scottsdale,"Scottsdale, Maricopa County, Arizona, United States"
12,Omaha,"Omaha, Douglas County, Nebraska, United States"
13,Hillsborough Township,"Hillsborough Township, Somerset County, New Jersey, United States"
14,Naples,"Napoli, Campania, Italia"
15,Tyrone,"County Tyrone, Ulster, Northern Ireland, United Kingdom"
16,Edgewood,"Edgewood, Clayton County, Iowa, United States"
17,Northbrook,"Northbrook, Cook County, Illinois, 60062, United States"
18,Loveland,"Loveland, Larimer County, Colorado, 80537, United States"
19,Foxborough,"Foxborough, Norfolk County, Massachusetts, 02035, United States"
20,Denver,"Denver, Colorado, United States"
21,North Charleston,"North Charleston, Charleston County, South Carolina, United States"
22,Bohemia,"Bohemia, Town of Islip, Suffolk County, New York, 11716, United States"
23,Trevose,"Trevose, Bensalem Township, Bucks County, Pennsylvania, 19053, United States"
24,Arden,"Ardennes, Grand Est, France métropolitaine, France"
25,Hampton,"Hampton, Virginia, United States"
26,Germantown,"Germantown, Clinton County, Illinois, United States"
27,Leander,"Leander, Williamson County, Texas, 78641, United States"
28,Wayne,"Wayne County, Illinois, United States"
29,Santa Clara,"Santa Clara County, California, United States"
30,Bremerton,"Bremerton, Kitsap County, Washington, United States"
31,Orland Park,"Orland Park, Orland Township, Cook County, Illinois, 60462, United States"
32,Chicago,"Chicago, Cook County, Illinois, United States"
33,Topeka,"Topeka, Shawnee County, Kansas, United States"
34,Norcross,"Norcross, Gwinnett County, Georgia, 30071, United States"
35,Lake Worth,"Lake Worth, Tarrant County, Texas, United States"
36,Sarasota,"Sarasota, Sarasota County, Florida, United States"
37,Ira Township,"Ira Township, Saint Clair County, Michigan, 48023, United States"
38,Tomball,"Tomball, Harris County, Texas, 77375, United States"
39,Las Vegas,"Las Vegas, Clark County, Nevada, United States"
40,Brookfield,"Brookfield, Proviso Township, Cook County, Illinois, 60513, United States"
41,Largo,"Largo, Pinellas County, Florida, United States"
42,Oklahoma City,"Oklahoma City, Oklahoma County, Oklahoma, United States"
43,Vista,"Vista, San Diego County, California, United States"
44,Fort Worth,"Fort Worth, Tarrant County, Texas, United States"
45,Hiram,"Hiram, Paulding County, Georgia, United States"
46,Rosenberg,"Rosenberg, Fort Bend County, Texas, 77471, United States"
47,Columbus,"Columbus, Franklin County, Ohio, United States"
48,Katy,"Katy, Fort Bend County, Texas, United States"
49,Columbia,Colombia
50,Boise,"Boise, Ada County, Idaho, United States"
51,Jacksonville,"Jacksonville, Duval County, Florida, United States"
52,Clearwater,"Clearwater, Pinellas County, Florida, United States"
53,Dallas,"Dallas, Dallas County, Texas, United States"
54,Melbourne,"Melbourne, City of Melbourne, Victoria, Australia"
55,South River,"South River, Middlesex County, New Jersey, 08882, United States"
56,Norfolk,"Norfolk, England, United Kingdom"
57,Greer,"Greer County, Oklahoma, United States"
58,Hollywood,"Hollywood, Los Angeles, Los Angeles County, California, United States"
59,San Diego,"San Diego, San Diego County, California, United States"
60,Glenshaw,"Glenshaw, Shaler Township, Allegheny County, Pennsylvania, 15116, United States"
61,Lafayette,"Lafayette, Lafayette Parish, Louisiana, United States"
62,Winder,"Winder, Barrow County, Georgia, 30680, United States"
63,Tampa,"Tampa, Hillsborough County, Florida, United States"
64,Waco,"Waco, McLennan County, Texas, United States"
65,Eden Prairie,"Eden Prairie, Hennepin County, Minnesota, United States"
66,Myrtle Beach,"Myrtle Beach, Horry County, South Carolina, 29577, United States"
67,Pennsauken Township,"Pennsauken Township, Camden County, New Jersey, 08110, United States"
68,Machesney Park,"Machesney Park, Harlem Township, Winnebago County, Illinois, 61115, United States"
69,Lavon,"Lavon, Collin County, Texas, 75166, United States"
70,Houston,"Houston, Harris County, Texas, United States"
71,Overland Park,"Overland Park, Johnson County, Kansas, United States"
72,Clive,"Clive, Polk County, Iowa, 50325, United States"
73,Mt Airy,"Mt. Airy, Perdmontemps, Saint David, Grenada"
74,Bloomfield,"Bloomfield, Davis County, Iowa, United States"
75,Lancaster,"Lancaster, Lancaster County, Pennsylvania, United States"
76,Louisville,"Louisville, Jefferson County, Kentucky, United States"
77,Madison Heights,"Madison Heights, Oakland County, Michigan, 48071, United States"
78,Jasper,"Jasper County, Texas, United States"
79,Savannah,"Savannah, Chatham County, Georgia, United States"
80,Lexington,"Lexington, Fayette County, Kentucky, United States"
81,Baton Rouge,"Baton Rouge, East Baton Rouge Parish, Louisiana, United States"
82,Port St. Lucie,"Port Saint Lucie, Saint Lucie County, Florida, United States"
83,Warwick,"Warwick, Warwickshire, England, United Kingdom"
84,Fairfield,"Fairfield County, Ohio, United States"
85,Milwaukee,"Milwaukee, Milwaukee County, Wisconsin, United States"
86,Smyrna,"İzmir, Konak, İzmir, Ege Bölgesi, 00000, Türkiye"
87,Olympia,"Ολυμπία, Αρχαία Ολυμπία, Δήμος Αρχαίας Ολυμπίας, Περιφερειακή Ενότητα Ηλείας, Περιφέρεια Δυτικής Ελλάδας, Αποκεντρωμένη Διοίκηση Πελοποννήσου, Δυτικής Ελλάδας και Ιονίου, 270 65, Ελλάς"
88,Stamford,"Stamford, Fairfield County, Connecticut, United States"
89,Cypress,"Cypress, Harris County, Texas, 77433, United States"
90,Lowell,"Lowell, Middlesex County, Massachusetts, United States"
91,Cleveland,"Cleveland, Cuyahoga County, Ohio, United States"
92,Naperville,"Naperville, DuPage County, Illinois, United States"
93,Dickinson,"Dickinson County, Kansas, United States"
94,Charlotte,"Charlotte, Mecklenburg County, North Carolina, United States"
95,Leland,"Leland, Brunswick County, North Carolina, United States"
96,St. Louis,"Saint Louis, Missouri, United States"
97,McKinney,"McKinney, Collin County, Texas, United States"
98,Kalamazoo,"Kalamazoo, Kalamazoo County, Michigan, United States"
99,Little Rock,"Little Rock, Pulaski County, Arkansas, United States"
100,Austin,"Austin, Travis County, Texas, United States"
101,Plano,"Plano, Collin County, Texas, United States"
102,Colorado Springs,"Colorado Springs, El Paso County, Colorado, United States"
103,Upper Marlboro,"Upper Marlboro, Prince George's County, Maryland, United States"
104,Indianapolis,"Indianapolis, Marion County, Indiana, United States"
105,Cudahy,"Cudahy, Los Angeles County, California, United States"
106,Clinton Twp,"Clinton Township, Macomb County, Michigan, United States"
107,Hutto,"Hutto, Williamson County, Texas, 78634, United States"
108,Byron,"Byron, Olmsted County, Minnesota, 55920, United States"
109,Minnetonka,"Minnetonka, Hennepin County, Minnesota, United States"
110,Branford,"Branford, New Haven County, Connecticut, 06405, United States"
111,Robertsdale,"Robertsdale, Baldwin County, Alabama, United States"
112,Hamilton Township,"Hamilton Township, Van Buren County, Michigan, United States"
113,Oregon City,"Oregon City, Clackamas County, Oregon, 97045, United States"
114,New Brighton,"New Brighton, Ramsey County, Minnesota, 55112, United States"
115,Absecon,"Absecon, Atlantic County, New Jersey, 08201, United States"
116,Fresno,"Fresno, Fresno County, California, United States"
117,Greensboro,"Greensboro, Guilford County, North Carolina, United States"
118,Stephens City,"Stephens City, Frederick County, Virginia, United States"
119,Enon,"Enon, Cape Breton Regional Municipality, Cape Breton County, Nova Scotia, Canada"
120,Nashville,"Nashville-Davidson, Davidson County, Tennessee, United States"
121,Portland,"Portland, Multnomah County, Oregon, United States"
122,Lynnwood,"Lynnwood, Snohomish County, Washington, United States"
123,Lumberton,"Lumberton, Robeson County, North Carolina, United States"
124,Cary,"Cary, Wake County, North Carolina, United States"
125,Flint,"Flint, Genesee County, Michigan, United States"
126,Florence,"Firenze, Toscana, Italia"
127,Lombard,"Lombard, Besançon, Doubs, Bourgogne-Franche-Comté, France métropolitaine, 25440, France"
128,Plant City,"Plant City, Hillsborough County, Florida, United States"
129,Rockville,"Rockville, Montgomery County, Maryland, United States"
130,Charlottesville,"Charlottesville, Virginia, United States"
131,Conroe,"Conroe, Montgomery County, Texas, United States"
132,Bend,"Bend, Deschutes County, Oregon, United States"
133,Avondale,"Avondale, Maricopa County, Arizona, United States"
134,South Daytona,"South Daytona, Volusia County, Florida, United States"
135,Bellaire,"Bellaire, Harris County, Texas, United States"
136,Orlando,"Orlando, Orange County, Florida, United States"
137,Hilliard,"Hilliard, Norwich Township, Franklin County, Ohio, United States"
138,Wichita,"Wichita, Sedgwick County, Kansas, United States"
139,Poway,"Poway, San Diego County, California, 92064, United States"
140,West Chester,"West Chester, Chester County, Pennsylvania, 19383, United States"
141,Birmingham,"Birmingham, West Midlands Combined Authority, England, United Kingdom"
142,Winston,"Winston County, Mississippi, United States"
143,Lincoln,"Lincoln, Lancaster County, Nebraska, United States"
144,Wilmington,"Wilmington, New Castle County, Delaware, United States"
145,Spokane Valley,"Spokane Valley, Spokane County, Washington, United States"
146,Knoxville,"Knoxville, Knox County, Tennessee, United States"
147,Lakeville,"Lakeville, Dakota County, Minnesota, 55044, United States"
148,Murfreesboro,"Murfreesboro, Rutherford County, Tennessee, United States"
149,Coplay,"Coplay, Lehigh County, Pennsylvania, United States"
150,McFarland,"McFarland, Kern County, California, 93520, United States"
151,Livonia,"Livonia, Wayne County, Michigan, United States"
152,Belton,"Belton, Bell County, Texas, United States"
153,Falls Church,"Falls Church, Virginia, 22046, United States"
154,San Antonio,"San Antonio, Bexar County, Texas, United States"
155,Raleigh,"Raleigh, Wake County, North Carolina, United States"
156,Carrollton,"Carrollton, Dallas County, Texas, United States"
157,Tucker,"Tucker, DeKalb County, Georgia, 30084, United States"
158,Tukwila,"Tukwila, King County, Washington, United States"
159,Hatfield,"Hatfield, Welwyn Hatfield, Hertfordshire, England, United Kingdom"
160,Orange County,"Orange County, California, United States"
161,San Antonio Northwest,"San Antonio, Rota, Costa Noroeste, Cádiz, Andalucía, 11520, España"
162,Eastern Iowa,"Eastern Iowa Airport, Welty Park Lane Southwest, Cedar Rapids, Linn County, Iowa, United States"
163,Chicago Downtown,"Chicago, 67, Пушкіна вулиця, Одеський, Соснівський район, Черкаси, Черкаська міська громада, Черкаський район, Черкаська область, 18023, Україна"
164,Sacramento,"Sacramento, Sacramento County, California, United States"
165,Chicago North,"Chicago, 300, West Chicago Avenue, Cabrini-Green, River North, Near North Side, Chicago, Cook County, Illinois, 60654, United States"
166,Atlanta Southeast,"United States Penitentiary, Atlanta, 601, McDonough Boulevard Southeast, Thomasville, Atlanta, Fulton County, Georgia, 30315, United States"
167,St. Paul,"Saint Paul, Ramsey County, Minnesota, United States"
168,Massachusetts South Shore,"South Shore, Long Josephs Point, Nantucket, Massachusetts, United States"
169,Reno,"Reno, Washoe County, Nevada, United States"
170,Charleston,"Charleston, Charleston County, South Carolina, United States"
171,San Diego Downtown,"Downtown, Escondido, San Diego County, California, United States"
172,Northwest Indiana,"Northwest, 612, South Huntington Street, Wawasee Village, Syracuse, Kosciusko County, Indiana, 46567, United States"
173,Salt Lake City,"Salt Lake City, Salt Lake County, Utah, United States"
174,Phoenix,"Phoenix, Maricopa County, Arizona, United States"
175,Middlesex,"Middlesex, Hertfordshire, Greater London, England, United Kingdom"
176,Long Beach,"Long Beach, Los Angeles County, California, United States"
177,Atlanta,"Atlanta, Fulton County, Georgia, United States"
178,Tucson,"Tucson, Pima County, Arizona, United States"
179,Baltimore,"Baltimore, Maryland, United States"
180,Contra Costa,"Contra Costa County, California, United States"
181,Northwest Arkansas,"Northwest Arkansas National Airport, Airport Boulevard, Highfill, Benton County, Arkansas, United States"
182,Boston,"Boston, Suffolk County, Massachusetts, United States"
183,Northshore,"Northshore, Northeast, 822433, Singapore"
184,South Bay,"South Bay, Palm Beach County, Florida, 33493, United States"
185,Monterey,"Monterey County, California, United States"
186,Rochester,"City of Rochester, Monroe County, New York, United States"
187,San Francisco,"San Francisco, California, United States"
188,Minneapolis,"Minneapolis, Hennepin County, Minnesota, United States"
189,Pittsburgh,"Pittsburgh, Allegheny County, Pennsylvania, United States"
190,Connecticut,"Connecticut, United States"
191,Dayton,"Dayton, Montgomery County, Ohio, United States"
192,Syracuse,"City of Syracuse, Onondaga County, New York, United States"
193,Rhode Island,"Rhode Island, United States"
194,Fort Lauderdale South,"South Fork New River, Fort Lauderdale, Broward County, Florida, 33312, United States"
195,San Fernando Valley,"San Fernando Valley, Los Angeles, Los Angeles County, California, 91406, United States"
196,Peninsula,"Peninsula, Summit County, Ohio, United States"
197,Greater Philadelphia,"Greater Grays Ferry Estates, South Philadelphia, Philadelphia, Philadelphia County, Pennsylvania, United States"
198,Palm Beach,"Palm Beach County, Florida, United States"
199,Northern Kentucky,"Northern, Floyd County, Kentucky, 41622, United States"
200,Fairfax,"Fairfax, Virginia, United States"
201,the CSRA,None
202,Long Island,"Long Island, New York, United States"
203,Collin County,"Collin County, Texas, United States"
204,Greater Boston,"Boston, 16, Beesley Street, Hill End, West End, Greater Brisbane, Queensland, 4101, Australia"
205,Greater Seattle,"Greater Seattle Eckankar Center, 9044, 35th Avenue Southwest, Westwood, Seattle, King County, Washington, 98126, United States"
206,The Junkluggers,None
207,Kentucky,"Kentucky, United States"
208,North Puget Sound,"University of Puget Sound, 1500, North Warner Street, Tacoma, Pierce County, Washington, 98416, United States"
209,Greater NW Indiana,"Girl Scouts of Greater Chicago and Northwest Indiana, 650, Lakeview Parkway, Vernon Hills, Lake County, Illinois, 60061, United States"
210,Northwest DC,"Northwest, Washington, District of Columbia, 20008, United States"
211,Lehigh Valley,"Lehigh Valley, Pennsylvania Turnpike Northeast Extension, Crackersport, South Whitehall Township, Lehigh County, Pennsylvania, 18106, United States"
212,Greater Sugar Land,None
213,Kansas City,"Kansas City, Jackson County, Missouri, United States"
214,Fairfield & Westchester Counties,None
215,North Tampa Bay,"Tampa Bay Pressure Washing Services, 5001, North Nebraska Avenue, Southeast Seminole Heights, Tampa, Hillsborough County, Florida, 33603, United States"
216,New York City,"City of New York, New York, United States"
217,West LA,"West Lane, Linthorpe, Middlesbrough, Tees Valley, England, United Kingdom"
218,"Bucks, Montgomery, and Philadelphia Counties",None
219,Southwest Las Vegas,"Las Vegas, Sappa Road, Ambas Bay, Limbé, Limbé I, Communauté urbaine de Limbé, Fako, Southwest, Cameroun"
220,Southwest Florida,"Southwest, Hillsborough County, Florida, 33503, United States"
221,New Orleans,"New Orleans, Orleans Parish, Louisiana, United States"
222,Greater Hartford,"Hartford, Masons Lane, Paekākā, Wellington Central, Wellington, Wellington City, Wellington, 6140, New Zealand / Aotearoa"
223,Colorado,"Colorado, United States"
224,League City & Pearland,None
225,Southern LA County,"Southern Lane, Village of Warwick, Town of Warwick, Orange County, New York, 10990, United States"
226,Southeastern MA & RI,"U.S. Coast Guard, Risho Avenue, East Providence, Providence County, Rhode Island, 02915, United States"
227,Northern New Jersey,"Northern Burlington County Regional High School, Wayne Drive East, Mansfield Township, Burlington County, New Jersey, 08022, United States"
228,Broward West and Palm Beach South,None
229,Vancouver and SE Portland,None
230,Round Rock & Georgetown,"North Georgetown Street, Round Rock, Williamson County, Texas, 78664, United States"
231,El Paso,"El Paso, El Paso County, Texas, United States"
232,Treasure Valley,"Treasure Valley, Claremont, Los Angeles County, California, 91784, United States"
233,The Northtowns,"Boys & Girls Clubs of the Northtowns Black Rock Assuption Club, Germain Street, Buffalo, Erie County, New York, 14207, United States"
234,Northeast FL,"Northeast, Hillsborough County, Florida, 33503, United States"
235,Queens,"Queens, City of New York, New York, United States"
236,A2 & Novi,"Zagrebačka obilaznica, Ježdovec, Gradska četvrt Novi Zagreb - zapad, Zagreb, Grad Zagreb, 10172, Hrvatska"
237,"Berks, Chester & Lancaster",None
238,Chicago NW Suburbs,"Chicago Avenue, Maroubra, Eastern Suburbs, Sydney, Randwick City Council, New South Wales, 2035, Australia"
239,Greater Santa Clarita Valley,None
240,Raleigh-Durham,"Durham, McAlpin, Raleigh County, West Virginia, 25921, United States"
241,Greater Dallas,"Dallas, 355, Wandsworth Road, Stockwell, London Borough of Lambeth, London, Greater London, England, SW8 2JH, United Kingdom"
242,Eugene & Bend,"Dragonfly Bend, Eugene, Lane County, Oregon, United States"
243,Lake County,"Lake County, California, United States"
244,St. Johns,"Saint Johns County, Florida, United States"
245,Atlanta Metro East,None
246,the Lower Hudson Valley,None
247,the Jersey Shore,"Shore Avenue, The Oaks at Stafford, Stafford Township, Ocean County, New Jersey, 08050, United States"
248,Akron-Canton,"Akron-Canton Airport, 5400, Lauby Road, North Canton, Summit County, Ohio, 44720, United States"
249,Junkluggers & Luggers Moving of Wilmington,None
250,Abington,"Abington Township, Montgomery County, Pennsylvania, United States"
251,Vancouver,"Vancouver, Metro Vancouver Regional District, British Columbia, Canada"
252,Canoga Park,"Canoga Park, Los Angeles, Los Angeles County, California, 91303, United States"
253,Duarte,"Duarte, República Dominicana"
254,Cincinnati,"Cincinnati, Hamilton County, Ohio, United States"
255,Chelmsford,"Chelmsford, Essex, England, United Kingdom"
256,Irvine,"Irvine, Orange County, California, United States"
257,Central New Jersey,"New Jersey, Timog Park Homes, Angeles, Central Luzon, 2009, Pilipinas / Philippines"
258,Tulsa,"Tulsa, Tulsa County, Oklahoma, United States"
259,New Haven County,"New Haven County, Connecticut, United States"
260,North Texas,"Texas, Camden County, North Carolina, 27974, United States"
261,Madison,"Madison, Dane County, Wisconsin, United States"
262,Mid-Michigan,"Tee Box (Front, Middle, Back), Prairie Ronde Township, Kalamazoo County, Michigan, United States"
263,Anchorage,"Anchorage, Alaska, 99501, United States"
264,Palm Springs,"Palm Springs, Riverside County, California, United States"
265,Albany,Shqipëria
266,Dallas Mid Cities,None
267,Philadelphia,"Philadelphia, Philadelphia County, Pennsylvania, United States"
268,Charlotte Central,"Charlotte, Pulpogan, Cebu, Central Visayas, 6001, Pilipinas / Philippines"
269,Des Moines,"Des Moines, Polk County, Iowa, United States"
270,The Triangle,"Research Triangle, Wake County, North Carolina, 27617, United States"
271,Los Angeles,"Los Angeles, Los Angeles County, California, United States"
272,North Boston & Southern NH,None
273,Adirondack Junkluggers,None
274,East Tennessee,"East Tennessee, United States"
275,Massachusetts North Shore,"South Shore Vocational Technical High School, 476, Webster Street, North Hanover, Hanover, Plymouth County, Massachusetts, 02339, United States"
276,NW Houston and The Woodlands,None
277,Greater Grand Rapids,None
278,Alameda,"Alameda County, California, United States"
279,San Diego North,"San diego, RN2, Lac Vert, Goma, Nord-Kivu, République démocratique du Congo"
280,"Grapevine, Irving & Denton",None
281,Detroit South & Northeast Suburbs,None
282,Minneapolis St. Paul,"Minneapolis-Saint Paul International Airport, 4300, Glumack Drive, Minneapolis, Hennepin County, Minnesota, 55450, United States"
283,Williamsburg,"Williamsburg, Virginia, United States"
284,Gold Country,"Gold Country, Maltepe, İstanbul, Marmara Bölgesi, 34854, Türkiye"
285,Tallahassee,"Tallahassee, Leon County, Florida, United States"
286,Greater San Jose,"José de San Martín, Belgrave Square, Belgravia, London, Greater London, England, SW1X 8QT, United Kingdom"
287,San Jose,"San Jose, Santa Clara County, California, United States"
288,St. Louis South,"Saint Louis, 430, South 15th Street, Downtown West, Saint Louis, Missouri, 63103, United States"
289,St. Louis MO,"Saint Louis, Missouri, United States"
290,Dublin,"Dublin, County Dublin, Leinster, Éire / Ireland"
291,Canton,"Canton, Van Zandt County, Texas, 75103, United States"
292,Carlsbad,"Carlsbad, San Diego County, California, United States"
293,Lehi,"Lehi, Utah County, Utah, 84043, United States"
294,Saint Louis,"Saint Louis, Missouri, United States"
295,Not Available,"Not available, Date Lane, Bahia Puesta del Sol, Caye Caulker, Caye Caulker Village, Belize District, Belize"
296,Torrance,"Torrance, Los Angeles County, California, United States"
297,Inland Empire,"Inland Avenue, Empire, Stanislaus County, California, 95319, United States"
298,Washington DC,"Washington, District of Columbia, United States"
299,Serving,"Future Visitor Serving Accommodations & Community Park Site, Yacht Harbor Manor, Santa Cruz County, California, United States"
300,Chicago South,"Chicago, South Green Park Village 4, Parañaque, Southern Manila District, Metro Manila, 1700, Pilipinas / Philippines"
301,Anaheim,"Anaheim, Orange County, California, United States"
302,Greater Los Angeles,"Greater True Friendship Church, 1843, West Vernon Avenue, Vermont Square, Los Angeles, Los Angeles County, California, 90062, United States"
303,Manhattan,"Manhattan, New York County, City of New York, New York, United States"
304,Silicon Valley,"Silicon Valley, Palo Alto, Santa Clara County, California, 94301, United States"
305,Honolulu,"Honolulu, Honolulu County, Hawaii, 96813, United States"
306,Walnut Creek Metro,"C-Line, Almond Court, Walnut Creek, Contra Costa County, California, 94596, United States"
307,Brooklyn Queens,"Brooklyn, Region of Queens Municipality, Queens County, Nova Scotia, B0T 1K0, Canada"
308,San Diego South,"San Diego, São Luiz, Gravataí, Região Geográfica Imediata de Porto Alegre, Região Metropolitana de Porto Alegre, Região Geográfica Intermediária de Porto Alegre, Rio Grande do Sul, Região Sul, 94065-466, Brasil"
309,Florida Miami,"Miami, Miami-Dade County, Florida, United States"
310,Elk Grove Village,"Elk Grove Village, Elk Grove Township, Cook County, Illinois, 60007, United States"
311,Somerset,"Somerset, England, United Kingdom"
312,Pasadena,"Pasadena, Los Angeles County, California, United States"
313,Manhattan & Brooklyn,"Brooklyn, Manhattan Villas, Parañaque, Southern Manila District, Metro Manila, 1711, Pilipinas / Philippines"
314,West Los Angeles,"West Los Angeles, Los Angeles, Los Angeles County, California, United States"
315,Santa Clarita,"Santa Clarita, Los Angeles County, California, United States"
316,Philadelphia & Montgomery County,"Philadelphia College of Osteopathic Medicine, 4170, City Avenue, Sutton Terrace, Philadelphia, Montgomery County, Pennsylvania, 19131, United States"
317,Queens & Long Island,"Long Island, Wickham Parish, Queens County, New Brunswick / Nouveau-Brunswick, Canada"
318,Baltimore Catonsville,"Catonsville, Baltimore County, Maryland, United States"
319,Seattle Central,"Central District, Seattle, King County, Washington, 98122, United States"
320,Northern Virginia,"Virginia, Litchfield Municipality, Northern Territory, Australia"
321,Boston South,"Boston, The District Council of Lower Eyre Peninsula, South Australia, 5607, Australia"
322,Houston Central,"Houston, Glory Heights, Santo Tomas, Pampanga, Central Luzon, Pilipinas / Philippines"
323,Tampa North,"Tampa, FL (TPA), 601 North, North Nebraska Avenue, Ybor City, Tampa, Hillsborough County, Florida, 33602, United States"
324,Tacoma,"Tacoma, Pierce County, Washington, United States"
325,Summerlin,"Summerlin, Las Vegas, Clark County, Nevada, 89134, United States"
326,Annapolis,"Annapolis, Anne Arundel County, Maryland, United States"
327,Dover,"Dover, Kent, England, United Kingdom"
328,Danbury,"Danbury, Fairfield County, Connecticut, United States"
329,Shoreline,"Shoreline, King County, Washington, 98155, United States"
330,Levittown,"Levittown, Town of Hempstead, Nassau County, New York, 11756, United States"
331,Richmond East,"Richmond, East Market Street, Richmond, Sydney, Hawkesbury City Council, New South Wales, 2753, Australia"
332,Bucks County,"Bucks County, Pennsylvania, United States"
333,Kennett Square,"Kennett Square, Chester County, Pennsylvania, United States"
