,City,Details
334,Trenton,"Trenton, Mercer County, New Jersey, United States"
335,Atlantic City,"Atlantic City, Atlantic County, New Jersey, 08401, United States"
336,Columbus North,"Columbus North, Lancaster, Fairfield County, Ohio, 43130, United States"
337,Acadiana,"Acadiana, Baton Rouge, East Baton Rouge Parish, Louisiana, 70806, United States"
338,Newnan,"Newnan, Coweta County, Georgia, 30263, United States"
339,Marietta,"Marietta, Cobb County, Georgia, United States"
340,Providence,"Providence, Providence County, Rhode Island, United States"
341,Somerset County,"Somerset County, Pennsylvania, United States"
342,New Brunswick,"New Brunswick / Nouveau-Brunswick, Canada"
343,Allentown,"Allentown, Lehigh County, Pennsylvania, United States"
344,Gig Harbor,"Gig Harbor, Pierce County, Washington, 98335, United States"
345,Renton,"Renton, King County, Washington, United States"
346,Palo Alto,"Palo Alto, Santa Clara County, California, United States"
347,West Valley,"West Valley, Valley Township, Armstrong County, Pennsylvania, 16200, United States"
348,Greater Sacramento,"Greater Solomon Temple Missionary Baptist Church, 24th Avenue, Sacramento, Sacramento County, California, 95820, United States"
349,Mansfield,"Mansfield, Richland County, Ohio, United States"
350,New Jersey South,"South, Middle Township, Cape May County, New Jersey, 08210, United States"
351,Jersey Shore,"Jersey Shore, Lycoming County, Pennsylvania, United States"
352,Delaware County,"Delaware County, Pennsylvania, United States"
353,Millsboro,"Millsboro, Sussex County, Delaware, United States"
354,Eastern Shore,"Eastern Shore, Patriot Circle, Fairfax County, Virginia, 22032, United States"
355,Frederick,"Frederick County, Virginia, United States"
356,Urbandale,"Urbandale, Polk County, Iowa, United States"
357,York,"York, England, YO1 8SG, United Kingdom"
358,New Jersey North East,"John F. Kennedy Boulevard East, North Bergen, Hudson County, New Jersey, 10069, United States"
359,New Jersey West,"New Jersey, West Carteret, Carteret, Middlesex County, New Jersey, 07008, United States"
360,Jefferson County,"Jefferson County, Texas, United States"
361,Boulder,"Boulder, Boulder County, Colorado, United States"
362,Alexandria,"الإسكندرية, 21519, مصر"
363,Wisconsin,"Wisconsin, United States"
364,Wisconsin South,"Wisconsin South, Kenwood, Bethesda, Montgomery County, Maryland, 22814, United States"
365,Virginia North,"Virginia, eThekwini Ward 36, Durban North, eThekwini Metropolitan Municipality, KwaZulu-Natal, 4051, South Africa"
366,Chamblee,"Chamblee, DeKalb County, Georgia, 30341, United States"
367,Kennesaw,"Kennesaw, Cobb County, Georgia, United States"
368,Connecticut Coast,"Fort Trumbull State Park, Downtown New London, New London, New London County, Connecticut, 06320, United States"
369,Virginia Beach,"Virginia Beach, Virginia, United States"
370,Worcester,"Worcester, Worcester County, Massachusetts, United States"
371,Chesterfield,"Chesterfield, Saint Louis County, Missouri, United States"
372,Utah County,"Utah County, Utah, United States"
373,Harrisburg,"Harrisburg, Dauphin County, Pennsylvania, United States"
374,Mesa,"Mesa, Maricopa County, Arizona, United States"
375,Gilbert,"Gilbert, Maricopa County, Arizona, United States"
376,Stockton,"Stockton, San Joaquin County, California, United States"
377,Austin Metro,"Austin, Fairview, 5th District, Quezon City, Eastern Manila District, Metro Manila, 1100, Pilipinas / Philippines"
378,Gwinnett,"Gwinnett County, Georgia, United States"
379,Cobb County,"Cobb County, Georgia, United States"
380,North Atlanta,"North Atlanta, Brookhaven, DeKalb County, Georgia, 39319, United States"
381,Greenwood,"Greenwood County, Kansas, United States"
382,Marin,"Marin County, California, United States"
383,Sonoma,"Sonoma County, California, United States"
384,Aiken,"Aiken County, South Carolina, United States"
385,Central VA,"Central, Wood County, West Virginia, 25105, United States"
386,Scottsdale and Mesa,None
387,Fairfield and Westchester Counties,None
388,Gainesville VA,"Gainesville, Prince William County, Virginia, 20155, United States"
389,Dallas Central,"Dallas, Glory Heights, Santo Tomas, Pampanga, Central Luzon, Pilipinas / Philippines"
390,Vermont,"Vermont, United States"
391,Louisville Metro,"Louisville Metro Hall, 527, West Jefferson Street, Louisville, Jefferson County, Kentucky, 40202, United States"
392,Quad Cities,None
393,Pinellas County,"Pinellas County, Florida, United States"
394,NW Arkansas,"Northwest Arkansas National Airport, Airport Boulevard, Highfill, Benton County, Arkansas, United States"
395,Oakland County,"Oakland County, Michigan, United States"
